corporate_number,name,location,postal_code,status,update_date,founded_year,都道府県,longitude,latitude
7010103002241,東京中橋合同会社,東京都八王子市北野台５丁目５０番５−４０７号,1920913.0,,2023-10-31 00:00:00+09:00,2023,東京都,139.351837,35.633297
8010501050089,ＴＯＰＰＡＮ株式会社,東京都台東区台東１丁目５番１号,1100016.0,,2023-10-31 00:00:00+09:00,2023,東京都,139.77858,35.700436
1011001157967,株式会社ＴＯＦ,東京都渋谷区神宮前３丁目１番２４号ソフトタウン青山４２５号室,1500001.0,,2023-11-01 00:00:00+09:00,2023,東京都,139.713959,35.670189
4020001145136,株式会社サイバーロジスティクス,神奈川県横浜市西区花咲町７丁目１５８番２号ＳＩＣ横浜ビル８Ｆ,2200022.0,,2023-11-01 00:00:00+09:00,2022,神奈川県,139.623322,35.458691
7010903008512,ペーパードライバー講習合同会社,東京都世田谷区深沢４丁目３３番２号,1580081.0,,2023-11-01 00:00:00+09:00,2023,東京都,139.654037,35.619503
8120005022053,一般社団法人ＰＧＭ緑化建設協会,大阪府大阪市鶴見区浜３丁目９−１１,5380035.0,,2023-11-01 00:00:00+09:00,2021,大阪府,135.584305,34.707939
2020001149130,コネクシオ株式会社,東京都港区虎ノ門４丁目１番１号,1050001.0,,2023-11-02 00:00:00+09:00,2022,東京都,139.744537,35.665405
2260001038458,株式会社両備ファイナンス,岡山県岡山市北区下石井２丁目１０番１２号,7000907.0,,2023-11-02 00:00:00+09:00,2023,岡山県,133.917969,34.658607
4010003041870,夢占い合同会社,東京都中央区銀座１丁目１２番４号Ｎ＆ＥＢＬＤ．７階,1040061.0,,2023-11-02 00:00:00+09:00,2023,東京都,139.770126,35.674221
4020001137059,アナウト株式会社,東京都千代田区内幸町２丁目１番６号１９階ＷｅＷｏｒｋ日比谷パークフロント,1000011.0,,2023-11-02 00:00:00+09:00,2020,東京都,139.753799,35.671448
5021001069976,株式会社ＴＲＩＮＥ．ＲＳ,神奈川県平塚市大神２丁目１５番１６号,2540012.0,,2023-11-02 00:00:00+09:00,2020,神奈川県,139.366104,35.392338
5120001224853,株式会社ＴＡＫＡＮＯ　ＥＳＴＡＴＥ,大阪府大阪市中央区安土町１丁目８番１５号野村不動産大阪ビル１階Ｂ区画,5410052.0,,2023-11-02 00:00:00+09:00,2019,大阪府,135.506638,34.684734
6011001157962,解体ＤＸ株式会社,東京都目黒区東山１丁目５番４号ＫＤＸ中目黒ビル３階,1530043.0,,2023-11-02 00:00:00+09:00,2023,東京都,139.695847,35.64653
6180301037370,株式会社マンダイディライト西日本,愛知県豊田市本地町４丁目２２番地１,4710848.0,,2023-11-02 00:00:00+09:00,2023,愛知県,137.11795,35.073334
9310001016625,株式会社サンチョク,長崎県長崎市田中町５８４番地１,8510134.0,,2023-11-02 00:00:00+09:00,2020,長崎県,129.94072,32.767834
1290001103672,株式会社Ｍ’ｓ　Ｆｕｔｕｒｅ　Ｃｒｅａｔｅ,福岡県福岡市東区松島１丁目１５番１−６０３号,8120062.0,,2023-11-06 00:00:00+09:00,2023,福岡県,130.436768,33.622025
1490003001540,清遠精肉店合同会社,高知県高知市弥生町５番２９号,7810803.0,,2023-11-06 00:00:00+09:00,2021,高知県,133.556152,33.561123
8020003024953,アンタレス・テン合同会社,神奈川県横浜市都筑区荏田南５丁目２３―４０フィスナコートセンター南Ｂ,2240007.0,,2023-11-06 00:00:00+09:00,2023,神奈川県,139.561386,35.551559
9140001132233,株式会社サイ,兵庫県明石市旭が丘１４番１４号,6730002.0,,2023-11-06 00:00:00+09:00,2023,兵庫県,134.969727,34.669033
1011501029955,株式会社モアプロ,東京都北区赤羽北３丁目２６番１−１３０３号,1150052.0,,2023-11-07 00:00:00+09:00,2023,東京都,139.704849,35.78017
2010901051031,株式会社ゼロアン,東京都世田谷区桜丘５丁目２８番６号シャーメゾン・セレッソ１０６,1560054.0,,2023-11-07 00:00:00+09:00,2022,東京都,139.619736,35.64304
2010401178309,メディカデリ株式会社,東京都港区西新橋１丁目１０番２号,1050003.0,,2023-11-08 00:00:00+09:00,2023,東京都,139.752716,35.66856
2220001025682,株式会社ＬＶＥ,石川県白山市井口町南３番地３,9202154.0,,2023-11-08 00:00:00+09:00,2023,石川県,136.602295,36.474792
4010001239178,株式会社ＯＬＤＥ,東京都千代田区九段北１丁目１３番５号,1020073.0,,2023-11-08 00:00:00+09:00,2023,東京都,139.750824,35.69656
4010001239871,株式会社２ｍｏｏｎ,東京都中央区日本橋室町１丁目１１番１２号日本橋水野ビル７Ｆ,1030022.0,,2023-11-08 00:00:00+09:00,2023,東京都,139.775772,35.685505
4012401035603,株式会社イニティウムグリーン,東京都府中市本宿町３丁目６番地１９,1830032.0,,2023-11-08 00:00:00+09:00,2019,東京都,139.46315,35.673885
7010701045088,トヨクモクラウドコネクト株式会社,東京都品川区上大崎３丁目１番１号,1410021.0,,2023-11-08 00:00:00+09:00,2023,東京都,139.716156,35.633621
7011803003735,株式会社旭グローバルサービス,東京都新宿区新宿５丁目１８−１２八重洲ビル４０Ａ,1600022.0,,2023-11-08 00:00:00+09:00,2019,東京都,139.70636,35.694771
8290801030028,株式会社青空,福岡県北九州市小倉南区志井６丁目１３番１５号,8020985.0,,2023-11-08 00:00:00+09:00,2023,福岡県,130.877777,33.816319
8370001044547,株式会社ＡＣＴ　ＡＲＩＳＥ,宮城県仙台市太白区西多賀１丁目３−７,9820034.0,,2023-11-08 00:00:00+09:00,2019,宮城県,140.860428,38.225899
2010101015877,株式会社エヌ管理,東京都八王子市富士見町３番４号,1920044.0,,2023-11-09 00:00:00+09:00,2023,東京都,139.350983,35.667389
2011001158056,株式会社ＣｈａｎｔｏＢｉｔ,東京都渋谷区道玄坂１丁目１０番８号渋谷道玄坂東急ビル２Ｆ−Ｃ,1500043.0,,2023-11-09 00:00:00+09:00,2023,東京都,139.69873,35.656879
6010001218568,株式会社ＯＮＯＤＥＲＡ　Ｃｒｅａｔｉｖｅ＆Ｔｅｃｈｎｏｌｏｇｙ,東京都千代田区大手町１丁目１番３号,1000004.0,,2023-11-09 00:00:00+09:00,2021,東京都,139.762329,35.685982
6290001103701,株式会社ＧＯＡＴ,福岡県福岡市中央区天神４丁目３番８号ミーナ天神８Ｆ,8100001.0,,2023-11-09 00:00:00+09:00,2023,福岡県,130.398712,33.592609
7260001038478,株式会社ウェルテック,岡山県岡山市南区妹尾３５１６,7010205.0,,2023-11-09 00:00:00+09:00,2023,岡山県,133.862518,34.619011
8010001210515,メディフォード株式会社,東京都板橋区清水町３６番１号,1740053.0,,2023-11-09 00:00:00+09:00,2020,東京都,139.705322,35.76255
8010001239785,株式会社コンビベース,東京都中央区日本橋茅場町３丁目１１番１０号ＰＭＯ日本橋茅場町ビル８階,1030025.0,,2023-11-09 00:00:00+09:00,2023,東京都,139.778976,35.677734
1011301029164,株式会社Ｉｎｔｅｇｒｉｔｙ,東京都杉並区高円寺南５丁目１０番１３号,1660003.0,,2023-11-10 00:00:00+09:00,2023,東京都,139.657379,35.702209
4290001085314,ＳｕｓｔａｉｎａｂｌｅＥｎｅｒｇｙ株式会社,東京都港区東麻布２丁目２０番３号ＡＺＡＢＥＥＴＥＲＲＡＣＥ４Ｆ,1060044.0,,2023-11-10 00:00:00+09:00,2019,東京都,139.742126,35.656303
1012403004947,クーミル株式会社,東京都新宿区西新宿６丁目１０番１号新宿オークシティ日土地西新宿ビル８階,1600023.0,,2023-11-13 00:00:00+09:00,2021,東京都,139.690628,35.694584
4010001212408,株式会社ココロトヒナタ,東京都中央区銀座１丁目１６番７号,1040061.0,,2023-11-13 00:00:00+09:00,2020,東京都,139.770294,35.674068
7370003005457,ＹＳＫ貿易合同会社,宮城県塩竈市新浜町３丁目２８番地４,9850001.0,,2023-11-13 00:00:00+09:00,2021,宮城県,141.050446,38.333557
8012301013283,株式会社ＢｉｚＰａｔｏ,東京都町田市原町田６丁目９番８号アエタ４階,1940013.0,,2023-11-13 00:00:00+09:00,2023,東京都,139.447052,35.543526
9010005037391,一般社団法人ロイヤルヘルスリソース,東京都文京区小石川１丁目９番１４−２００７号,1120002.0,,2023-11-13 00:00:00+09:00,2023,東京都,139.752502,35.711552
9011101099937,クルーズワークス株式会社,東京都新宿区下宮比町２番２８号飯田橋ハイタウン７０７,1620822.0,,2023-11-13 00:00:00+09:00,2022,東京都,139.744308,35.703396
1010405022703,税理士法人葵坂パートナーズ,東京都港区赤坂２丁目１８−３−２階,1070052.0,,2023-11-14 00:00:00+09:00,2023,東京都,139.739365,35.669086
2020003024991,合同会社Ｋｉｋｕ　ＫｎｉｇｈｔＳ,神奈川県横浜市港北区師岡町６２８番９,2220002.0,,2023-11-14 00:00:00+09:00,2023,神奈川県,139.637375,35.521713
4120003025342,リョウエン合同会社,大阪府守口市梶町３丁目３１番３４号,5700015.0,,2023-11-14 00:00:00+09:00,2023,大阪府,135.59227,34.747665
5460101007158,株式会社ノース環境,北海道帯広市西六条南２６丁目１３番地２,800016.0,,2023-11-14 00:00:00+09:00,2022,北海道,143.198486,42.901867
6030001139226,ＨＲマネージメント株式会社,東京都千代田区神田須田町１丁目５番１２号村山ビル５階,1010041.0,,2023-11-14 00:00:00+09:00,2020,東京都,139.770279,35.696278
4010001240045,東京海上レジリエンス株式会社,東京都千代田区大手町２丁目６番４号,1000004.0,,2023-11-15 00:00:00+09:00,2023,東京都,139.769455,35.684868
4012801022135,株式会社カイトプロモーション,東京都千代田区九段北４丁目３番２０号九段フラワーホーム４０１,1020073.0,,2023-11-15 00:00:00+09:00,2023,東京都,139.739426,35.694103
5010003042125,Ｒｕｔｅｎ　Ｊａｐａｎ合同会社,東京都中央区銀座１丁目１２番４号Ｎ＆ＥＢＬＤ．６Ｆ,1040061.0,,2023-11-15 00:00:00+09:00,2023,東京都,139.770126,35.674221
5010005037511,一般社団法人パラワールド,東京都文京区本郷１丁目１０番１２号−３０４号,1130033.0,,2023-11-15 00:00:00+09:00,2023,東京都,139.757706,35.704243
7011101105119,株式会社シサクウェア,東京都新宿区西新宿３丁目３番１３号西新宿水間ビル６階,1600023.0,,2023-11-15 00:00:00+09:00,2023,東京都,139.692841,35.685883
2011001158246,株式会社ＧＦＬＯＰＳ,東京都渋谷区道玄坂１丁目１０−８渋谷道玄坂東急ビル２Ｆ−Ｃ,1500043.0,,2023-11-16 00:00:00+09:00,2023,東京都,139.69873,35.656879
3030001147842,株式会社アゲイン,埼玉県さいたま市南区南浦和２丁目３−２日栄ビル１階,3360017.0,,2023-11-16 00:00:00+09:00,2022,埼玉県,139.668823,35.850468
4190001028225,株式会社ユーエムコーポレート,三重県亀山市亀田町１‐９,5190163.0,,2023-11-16 00:00:00+09:00,2021,三重県,136.455154,34.865135
5150001023419,株式会社Ａｃｅ‐Ｇｒｏｕｐ,大阪府大阪市北区長柄西１丁目４番９号ユニマックビル７Ｆ,5310061.0,,2023-11-17 00:00:00+09:00,2019,大阪府,135.511963,34.714226
7290003014623,Ｖ‐ｏｌｄ合同会社,福岡県福岡市博多区博多駅前１丁目２３番２号ＰａｒｋＦｒｏｎｔ博多駅前１丁目５Ｆ−Ｂ,8120011.0,,2023-11-17 00:00:00+09:00,2023,福岡県,130.418121,33.593727
9020001138028,株式会社ジャポリス,東京都台東区浅草２丁目７−２３大塚ビル１Ｆ,1110032.0,,2023-11-17 00:00:00+09:00,2020,東京都,139.794693,35.715149
2360003012302,Ｎｅｗ　Ｉｓｌａｎｄ株式会社,沖縄県沖縄市登川３丁目３６番７号プランドール・Ｎ２０２号室,9042142.0,,2023-11-20 00:00:00+09:00,2022,沖縄県,127.823746,26.371008
7040001125249,株式会社ＫＡＴＡＴＩ,千葉県東金市八坂台５丁目２番地４,2830801.0,,2023-11-20 00:00:00+09:00,2022,千葉県,140.356613,35.574036
9030001131097,ＡＱＵＡ　ＢＬＵＥ株式会社,東京都江戸川区東瑞江１丁目３４−７−１Ｆ,1320014.0,,2023-11-20 00:00:00+09:00,2019,東京都,139.899612,35.692001
9190003004509,Ｂｒａｎｄ　Ｎｅｗ　Ｐｉｘｉｅ合同会社,三重県桑名市常盤町２１番地,5110062.0,,2023-11-20 00:00:00+09:00,2023,三重県,136.691177,35.064903
2010403031408,エニラボ合同会社,東京都港区三田５丁目１番１２−５０７号,1080073.0,,2023-11-21 00:00:00+09:00,2023,東京都,139.736877,35.64716
3030001157271,株式会社ＭＫマージ,埼玉県川越市的場北２丁目２２番地２１,3501102.0,,2023-11-21 00:00:00+09:00,2023,埼玉県,139.438446,35.924995
5180001155283,アノマリーマーケティング株式会社,愛知県名古屋市中区栄２丁目２番２１号アーク白川公園ビルディング別館６階,4600008.0,,2023-11-21 00:00:00+09:00,2023,愛知県,136.899673,35.167358
6010401165006,Ｍｉｒａｒｔ株式会社,東京都中央区八丁堀１丁目７番７号八重洲レザンビル８階,1040032.0,,2023-11-21 00:00:00+09:00,2022,東京都,139.77652,35.677841
6020001145844,株式会社ＡＦＥ,神奈川県横浜市神奈川区台町１５−１２クレベール横浜１１０号,2210834.0,,2023-11-21 00:00:00+09:00,2022,神奈川県,139.618011,35.469776
6410001013648,ディーセントメディカル株式会社,秋田県秋田市川元山下町１番２７号コーポこまき１０３号,100931.0,,2023-11-21 00:00:00+09:00,2023,秋田県,140.104263,39.713497
8430001089783,株式会社ホワイトアライアンス,北海道札幌市豊平区月寒東四条１６丁目１番３号,620054.0,,2023-11-21 00:00:00+09:00,2023,北海道,141.420456,43.025871
9011101090557,株式会社Ｐａｒａｍｅ,東京都港区虎ノ門５丁目９−１麻布台ヒルズガーデンプラザＢ−５Ｆ,1050001.0,,2023-11-21 00:00:00+09:00,2019,東京都,139.743073,35.662209
9030003023037,ＳＦＣサポート合同会社,埼玉県さいたま市北区吉野町２丁目１７２番地１１,3310811.0,,2023-11-21 00:00:00+09:00,2023,埼玉県,139.604431,35.956383
1210005010039,一般社団法人ＳＯＥ,福井県鯖江市片山町第７号１０番地４,9161223.0,,2023-11-22 00:00:00+09:00,2022,福井県,136.276703,35.949863
4040001118981,株式会社ソフトメディカ,千葉県船橋市前原西２丁目１４番２号,2740825.0,,2023-11-22 00:00:00+09:00,2021,千葉県,140.020828,35.692146
4180001159046,Ｒｅｖａｌｕｅ株式会社,愛知県名古屋市北区上飯田西町３丁目１０−３,4620809.0,,2023-11-22 00:00:00+09:00,2023,愛知県,136.928787,35.204514
4360001031178,株式会社琉球エコライン,沖縄県那覇市字小禄１８３１−１沖縄産業支援センター３１７Ｉｚｙｕ,9010152.0,,2023-11-22 00:00:00+09:00,2022,沖縄県,127.661835,26.20355
5010001240267,東京海上スマートモビリティ株式会社,東京都千代田区大手町２丁目６番４号,1000004.0,,2023-11-22 00:00:00+09:00,2023,東京都,139.769455,35.684868
5020001143543,株式会社Ｓｏｕｖｅｎｉｒ　Ｃａｌｌ,神奈川県横浜市西区北幸１丁目１１番１号水信ビル７階,2200004.0,,2023-11-22 00:00:00+09:00,2021,神奈川県,139.618851,35.468071
9430001078760,Ｅｘｃｅｌｓｉｏｒ株式会社,北海道札幌市中央区北一条西３丁目３番１号ばらと北一条ビル９Ｆ−４２,600001.0,,2023-11-22 00:00:00+09:00,2019,北海道,141.35228,43.063015
7011001152905,Ｉｎｔｅｎｔ　Ｅｘｃｈａｎｇｅ株式会社,東京都文京区向丘２丁目３番１０号,1130023.0,,2023-11-24 00:00:00+09:00,2023,東京都,139.757919,35.7183
7240003006427,合同会社ライフィー,広島県広島市安佐南区西原２丁目２６番３９号,7310113.0,,2023-11-24 00:00:00+09:00,2023,広島県,132.465698,34.431355
7290001103816,株式会社ＳＵＢＴＥＸＴ,福岡県福岡市中央区草香江２丁目２−３−６０５号,8100045.0,,2023-11-27 00:00:00+09:00,2023,福岡県,130.375107,33.576736
9011001148389,株式会社Ｓｐａｃｅ　Ｑｕａｒｔｅｒｓ,東京都渋谷区神宮前５丁目５３番６７号,1500001.0,,2023-11-27 00:00:00+09:00,2022,東京都,139.708435,35.662521
9180001146452,株式会社カラボ,愛知県名古屋市中区錦２丁目１１−２４長者町コットンビル５Ｆ,4600003.0,,2023-11-27 00:00:00+09:00,2021,愛知県,136.900162,35.170395
9210001018557,株式会社Ａｉｔｈｒａ,福井県敦賀市相生町７番地の１６−２Ｆ,9140062.0,,2023-11-27 00:00:00+09:00,2021,福井県,136.068283,35.656475
2021005011722,一般社団法人健康サポート研究会,東京都武蔵野市境南町１丁目７番１号,1800023.0,,2023-11-28 00:00:00+09:00,2019,東京都,139.546646,35.701889
6010001237519,株式会社ＮｅｏＲｅａｌＸ,東京都港区虎ノ門３丁目１８番１９号,1050001.0,,2023-11-28 00:00:00+09:00,2023,東京都,139.746262,35.663155
6010905004510,一般社団法人ｔｓｕｎｄｏｋｕ,東京都世田谷区代田２丁目１番４号,1550033.0,,2023-11-28 00:00:00+09:00,2023,東京都,139.664642,35.65477
7010001224301,株式会社ｘＣＡＲＥ,東京都渋谷区東１丁目３１番１９号マンション渋谷並木橋３０４,1500011.0,,2023-11-28 00:00:00+09:00,2022,東京都,139.70636,35.654694
9430001088834,株式会社タグジェクト,北海道札幌市中央区大通西１０丁目４番地,600042.0,,2023-11-28 00:00:00+09:00,2023,北海道,141.342041,43.058464
2011001154237,株式会社いちか,東京都渋谷区上原１丁目３３番１６号オーツカビル３０４,1510064.0,,2023-11-29 00:00:00+09:00,2023,東京都,139.681076,35.669533
5013303004975,Ｂｒｉｌｌｉａｎｔ　Ｆｉｔｎｅｓｓ合同会社,神奈川県横浜市戸塚区上倉田町５０７−３，２−１,2440816.0,,2023-11-29 00:00:00+09:00,2020,神奈川県,139.535812,35.399853
5020001144079,株式会社Ｍ,神奈川県横浜市神奈川区栄町２番地１キコー横浜ビル４階,2210052.0,閉鎖,2023-11-29 00:00:00+09:00,2021,神奈川県,139.627686,35.4697
6430001090495,株式会社エルム産業,北海道札幌市豊平区福住三条６丁目１番３号,620043.0,,2023-11-29 00:00:00+09:00,2023,北海道,141.398605,43.012356
8010401171621,日本エス・エイチ・エル株式会社,東京都中野区中央５丁目３８番１６号,1640011.0,,2023-11-29 00:00:00+09:00,2022,東京都,139.66748,35.699238
4011201022869,株式会社ＩＣＯＭＡ,東京都大田区大森西６丁目１７番１７号ＫＯＣＡ・Ａ棟９号室,1430015.0,,2023-11-30 00:00:00+09:00,2021,東京都,139.729706,35.56847
9013301050976,株式会社ＢＰＣ,東京都港区芝浦４丁目１６番２５号,1080023.0,,2023-11-30 00:00:00+09:00,2023,東京都,139.747894,35.637554
1290001096438,株式会社ミモラ,福岡県福岡市中央区天神１丁目４−１西日本新聞会館１６階天神スカイホール内,8100001.0,,2023-12-01 00:00:00+09:00,2022,福岡県,130.401932,33.588455
2011001156919,株式会社Ｎａｔｉｏｎａｌ　Ｐａｒｋ　Ｓｏｌｕｔｉｏｎｓ,東京都渋谷区神宮前１丁目１４番１４号,1500001.0,,2023-12-01 00:00:00+09:00,2023,東京都,139.703644,35.670181
6130001068638,株式会社経営テクノサポート,京都府綴喜郡井手町大字多賀小字東北河原６２番地１０１号,6100301.0,,2023-12-01 00:00:00+09:00,2021,京都府,135.801346,34.821636
9011503004230,合同会社エターナルインクリース,東京都北区赤羽１丁目７番９号,1150045.0,,2023-12-01 00:00:00+09:00,2019,東京都,139.722214,35.779129
4010001203968,エムシーデジタル株式会社,東京都千代田区有楽町１丁目１番２号,1000006.0,,2023-12-04 00:00:00+09:00,2019,東京都,139.759552,35.674088
5011001141620,シェアオブシングス株式会社,東京都渋谷区円山町５番５号Ｎａｖｉ渋谷Ｖ３階,1500044.0,,2023-12-04 00:00:00+09:00,2021,東京都,139.695465,35.656757
1290001103482,株式会社ＤｅＬＴ,福岡県福岡市中央区天神２丁目１１番１号福岡ＰＡＲＣＯ新館５Ｆ,8100001.0,,2023-12-05 00:00:00+09:00,2023,福岡県,130.398895,33.59042
6010005034094,成実監査法人,東京都千代田区麹町３丁目３番地８麹町センタープレイス９階,1020083.0,,2023-12-06 00:00:00+09:00,2021,東京都,139.738632,35.683769
6400001014911,株式会社アイティーエヌ・ジェイワールド,岩手県盛岡市緑が丘３丁目４番３３号,200117.0,,2023-12-06 00:00:00+09:00,2020,岩手県,141.146011,39.733345
7010401153744,株式会社ケン・ホテルマネジメント琉球名城,東京都港区西麻布１丁目２番７号,1060031.0,,2023-12-06 00:00:00+09:00,2020,東京都,139.727112,35.661369
7430003011589,トライワークス合同会社,北海道札幌市豊平区西岡四条１０丁目２番５号西岡沼田ビル２０７号,620034.0,,2023-12-06 00:00:00+09:00,2020,北海道,141.384216,43.001865
8021001072044,株式会社ライブプロ,東京都港区赤坂４丁目１３番５号赤坂オフィスハイツ,1070052.0,,2023-12-06 00:00:00+09:00,2021,東京都,139.732254,35.67292
5210001017827,株式会社ＰＡＬＡＣＥ　ＦＲＯＮＴ,福井県福井市太田町１５号１６番地１,9190323.0,,2023-12-07 00:00:00+09:00,2019,福井県,136.228882,36.010906
6040003023666,合同会社ＰＹＴＨＯＮ　ＡＲＴ　ＷＯＲＫＳ,千葉県船橋市夏見台４丁目１０番１８号ソルーチェ夏見台２１５号,2730866.0,,2023-12-07 00:00:00+09:00,2023,千葉県,139.994217,35.724957
8120003018210,合同会社ＭＮＥＴ,大阪府大阪市西区靱本町１丁目５番１８号,5500004.0,,2023-12-07 00:00:00+09:00,2020,大阪府,135.497116,34.684986
9011301027755,株式会社フィーチャーブランチ,東京都港区虎ノ門４丁目１−２８虎ノ門タワーズオフィス１９階,1050001.0,,2023-12-07 00:00:00+09:00,2022,東京都,139.744537,35.665405
2010003036526,合同会社ＧＲＥＥＮトランスポートＰｌｕｓ,東京都新宿区新宿５丁目１８番２０号ルックハイツ新宿８０３号,1600022.0,,2023-12-08 00:00:00+09:00,2021,東京都,139.706482,35.693932
6010701043159,株式会社オープンゲート,東京都品川区西五反田１丁目２６番２号五反田サンハイツ９１１,1410031.0,,2023-12-08 00:00:00+09:00,2022,東京都,139.722748,35.624363
7010001240513,株式会社ＧＲＩＦＦＹ,東京都千代田区内神田２丁目１２番６号,1010047.0,,2023-12-08 00:00:00+09:00,2023,東京都,139.767441,35.691525
9011701024749,株式会社ＭＡＳＩＲＡ,東京都江戸川区北小岩５丁目３１番６号,1330051.0,,2023-12-08 00:00:00+09:00,2021,東京都,139.890991,35.74184
9410001012985,東成瀬テックソリューションズ株式会社,秋田県雄勝郡東成瀬村田子内字仙人下３０−１東成瀬村山村開発センター,190801.0,,2023-12-08 00:00:00+09:00,2021,秋田県,140.656235,39.175404
7010001233351,株式会社大菱計器製作所,新潟県長岡市南陽１丁目１２１６番地１,9401164.0,,2023-12-11 00:00:00+09:00,2023,新潟県,138.828476,37.412525
8360001032890,株式会社みなせ商会,沖縄県宮古島市平良字西里８９５番地の３,9060012.0,,2023-12-12 00:00:00+09:00,2023,沖縄県,125.298897,24.796242
9040001131261,株式会社ジェム,千葉県鎌ケ谷市鎌ケ谷１丁目１番１９号−１,2730105.0,,2023-12-12 00:00:00+09:00,2023,千葉県,140.011749,35.760406
8120001260540,パーソナルトリートメント株式会社,大阪府大阪市東淀川区相川２丁目１０番１６号,5330007.0,,2023-12-13 00:00:00+09:00,2023,大阪府,135.53511,34.757324
4080405007422,静岡キャリア形成支援協同組合,静岡県富士市瓜島町８２富士商工会議所３０６号,4170057.0,,2023-12-14 00:00:00+09:00,2022,静岡県,138.670425,35.165359
6010501051510,株式会社東京バイヤーズ,東京都台東区上野５丁目７番８号第６協立ビル５階,1100005.0,,2023-12-14 00:00:00+09:00,2023,東京都,139.775208,35.704224
8430001081550,株式会社Ｍｅｄｉ　Ｆａｃｅ,東京都中央区日本橋室町１丁目１１−１２日本橋水野ビル７階,1030022.0,,2023-12-14 00:00:00+09:00,2020,東京都,139.775772,35.685505
7010001233657,株式会社ＥｎＲｅｖ,東京都港区南青山４丁目１８番１１号フォレストヒルズイーストウィング２Ｆ,1070062.0,,2023-12-15 00:00:00+09:00,2023,東京都,139.717468,35.66349
1130001075952,株式会社ＲｅＯＮ　Ｔｅｃ,京都府京都市伏見区桃山最上町２番地,6120054.0,,2023-12-18 00:00:00+09:00,2023,京都府,135.77092,34.942383
2010001219495,秋葉原クリエイティブ株式会社,東京都千代田区外神田５丁目６−２菊池ビル１階,1010021.0,,2023-12-18 00:00:00+09:00,2021,東京都,139.772552,35.703236
3012701016650,株式会社Ｎｅｔｚ,東京都豊島区東池袋４丁目２７番５号ライオンズプラザ２０７,1700013.0,,2023-12-18 00:00:00+09:00,2021,東京都,139.719131,35.727772
4050001053955,沼尻産業株式会社,茨城県つくば市榎戸７８３番地の１２,3050853.0,,2023-12-18 00:00:00+09:00,2023,茨城県,140.101608,36.038315
3011101105543,株式会社ＺｉＤｉ,東京都新宿区西新宿３丁目３番１３号西新宿水間ビル６階,1600023.0,,2023-12-19 00:00:00+09:00,2023,東京都,139.692841,35.685883
3020005016227,特定非営利活動法人市民健康長寿ネット研究所,神奈川県横浜市都筑区茅ケ崎中央２３−１１ＯＳセンター南ビル６Ｆ,2240032.0,,2023-12-19 00:00:00+09:00,2023,神奈川県,139.571487,35.543171
