corporate_number,name,location,postal_code,status,update_date,founded_year,都道府県,longitude,latitude
2160005010729,一般社団法人救急医療搬送支援協会,滋賀県栗東市霊仙寺１丁目１番３６号,5203035.0,,2019-09-19 00:00:00+09:00,2019,滋賀県,135.97403,35.03825
3160001021712,株式会社ＣＯＭＡＲＳ,滋賀県草津市野路２丁目１８番１６号,5250059.0,,2022-02-28 00:00:00+09:00,2019,滋賀県,135.946518,35.000931
3160001022487,ＯＨＭＩ　Ｆｏｒｅｓｔ株式会社,滋賀県犬上郡多賀町大字多賀５７１番地,5220341.0,,2020-05-08 00:00:00+09:00,2020,滋賀県,136.288467,35.22406
3160001023130,株式会社ＦＬＣアドバンス,滋賀県草津市笠山３丁目１７−４３,5250072.0,,2021-02-24 00:00:00+09:00,2021,滋賀県,135.944534,34.983868
3160001024748,株式会社モリワキ印刷,滋賀県東近江市上南町３１３番地１,5291535.0,,2023-01-11 00:00:00+09:00,2023,滋賀県,136.171036,35.05658
4160001023708,株式会社キリカ,滋賀県近江八幡市堀上町字溝先１２５番７,5230031.0,,2021-10-07 00:00:00+09:00,2021,滋賀県,136.09256,35.119968
4290001100262,株式会社Ｍｉｎａｍｉｎ,滋賀県東近江市山路町２０４番地,5211225.0,,2023-06-09 00:00:00+09:00,2023,滋賀県,136.156082,35.182217
5160001023137,ＮＩＣＯＬＡＯ株式会社,滋賀県草津市下笠町３２０３番地,5250029.0,,2021-03-03 00:00:00+09:00,2021,滋賀県,135.929688,35.038685
6160001022591,株式会社岡本,滋賀県近江八幡市馬淵町１７１９番地,5230022.0,,2020-07-06 00:00:00+09:00,2020,滋賀県,136.108841,35.102924
7160001023093,株式会社ブリッジ,滋賀県大津市茶が崎６番１−１７０２号,5200023.0,,2021-02-09 00:00:00+09:00,2021,滋賀県,135.864304,35.024834
7160003001857,合同会社鳰不動産鑑定,滋賀県野洲市小篠原２１０１番地２風異音素テナント４Ｂ,5202331.0,,2019-07-16 00:00:00+09:00,2019,滋賀県,136.024796,35.067898
9160001021401,株式会社コンソリューション鑑定,滋賀県近江八幡市上田町１４７４番地,5230015.0,,2019-01-15 00:00:00+09:00,2019,滋賀県,136.114578,35.113209
9160001021533,株式会社Ｓｕｓｔａｉｎａｂｌｅ　Ｌｉｆｅ　Ｔｈｉｎｋｉｎｇ,滋賀県野洲市小篠原２１６８番地５,5202331.0,,2019-03-14 00:00:00+09:00,2019,滋賀県,136.021667,35.066055
9160001023050,株式会社ルア・コーポレーション,滋賀県大津市緑町２３−１０,5200221.0,,2021-01-29 00:00:00+09:00,2021,滋賀県,135.908096,35.145893
9160001024073,株式会社キヨトモエネックス,滋賀県彦根市安清町３番２７号,5220082.0,,2022-04-12 00:00:00+09:00,2022,滋賀県,136.261978,35.267681
1130001065061,アテンサプライ株式会社,京都府京都市伏見区中島中道町１３３番地,6128456.0,,2021-01-18 00:00:00+09:00,2019,京都府,135.745834,34.946823
1130001065144,株式会社プロポート,京都府京都市南区上鳥羽大柳町４１番地,6018128.0,,2022-08-18 00:00:00+09:00,2019,京都府,135.748154,34.96777
1130001066456,株式会社Ｌ．Ｉ．Ｐ,京都府京都市下京区水銀屋町６２０番地ＣＯＣＯＮ烏丸ビル４階,6008411.0,,2020-03-09 00:00:00+09:00,2020,京都府,135.759293,35.003082
1130001066811,株式会社ｄＴｏｓｈ,京都府相楽郡精華町光台１丁目７けいはんなプラザ,6190237.0,,2020-04-23 00:00:00+09:00,2020,京都府,135.764618,34.745415
1130001066976,日本交通株式会社,京都府舞鶴市字浜１１４４番地１２,6250036.0,,2020-05-29 00:00:00+09:00,2020,京都府,135.394547,35.470222
1130001067099,アーク株式会社,京都府宇治市木幡熊小路４３番地５５,6110002.0,,2020-06-17 00:00:00+09:00,2020,京都府,135.791931,34.921635
1130001067438,ＮＯＡＨ　ＣＯＲＰＯＲＡＴＩＯＮ株式会社,京都府京都市左京区鞍馬本町１５９番地,6011111.0,,2020-08-13 00:00:00+09:00,2020,京都府,135.768997,35.114468
1130001068799,株式会社文化資本創研,京都府京都市下京区木津屋橋通堀川西入川端町３２２番地,6008252.0,,2021-03-10 00:00:00+09:00,2021,京都府,135.758743,34.987183
1130001071497,ｂｌｕｅ　ａｎｄ　ｔｅｃｈ株式会社,京都府京都市中京区御池通東洞院東入笹屋町４３６永和御池ビル６０６号,6048187.0,,2022-04-11 00:00:00+09:00,2022,京都府,135.761856,35.01099
1130001073114,株式会社ブレベット情報サービス,京都府京都市西京区上桂前川町１１６番地,6158211.0,,2022-11-16 00:00:00+09:00,2022,京都府,135.697784,34.994469
1130001073980,株式会社アートプラット,京都府京都市南区上鳥羽菅田町２２番地２,6018102.0,,2023-06-27 00:00:00+09:00,2023,京都府,135.747314,34.972805
1130003007714,合同会社Ｂｉｚあしたば,京都府京都市山科区日ノ岡堤谷町７５番地１８,6078494.0,,2022-01-25 00:00:00+09:00,2022,京都府,135.80191,34.996586
1130005016250,一般社団法人ＮｅｕｒｏＰｉａｎｏ,京都府京都市下京区松原通東洞院東入本燈籠町１３−１,6008086.0,,2021-08-18 00:00:00+09:00,2021,京都府,135.761673,34.999077
2130001067206,村川造船所株式会社,京都府舞鶴市字長浜７２３番地６,6250086.0,,2020-07-07 00:00:00+09:00,2020,京都府,135.365219,35.488571
2130001071216,株式会社ＹＵＴＡＫＡ,京都府舞鶴市天台新町６３番地４,6240909.0,,2022-02-25 00:00:00+09:00,2022,京都府,135.359741,35.452118
2130003007705,合同会社ＹｏＫｕＮａＲｕ,京都府京都市右京区梅津北町４１番地８,6150911.0,,2022-01-20 00:00:00+09:00,2022,京都府,135.702133,35.0023
2260003003022,Ｊ‐Ｖ　ＧＬＯＢＡＬ合同会社,京都府京都市南区上鳥羽南島田町１番地,6018183.0,,2021-02-24 00:00:00+09:00,2019,京都府,135.742981,34.965607
3130001064053,株式会社関西テクノ,京都府舞鶴市字小倉６８番地４,6250020.0,,2019-09-09 00:00:00+09:00,2019,京都府,135.427673,35.481117
3130001065605,株式会社エクスペリメンタル,京都府京都市中京区御池通東洞院東入笹屋町４３６番地永和御池ビル６０６号,6048187.0,,2019-11-08 00:00:00+09:00,2019,京都府,135.761856,35.01099
3130001069647,辰正開発株式会社,京都府福知山市字正明寺１番地の３６,6200936.0,,2021-07-08 00:00:00+09:00,2021,京都府,135.104187,35.286716
3130001072477,株式会社最中屋,京都府京都市中京区壬生檜町６番地ＳＴハウス２Ｆ,6048844.0,,2022-08-18 00:00:00+09:00,2022,京都府,135.734283,34.999638
4120001247384,Ｌａｎｄｓｃａｐｅｒ株式会社,京都府京都市中京区橋弁慶町２２４ＳＯＨＯ烏丸２０４,6048151.0,,2023-02-20 00:00:00+09:00,2022,京都府,135.758972,35.005989
4130001063871,ＥＳ株式会社,京都府舞鶴市字万願寺１８６−１,6240814.0,,2019-03-08 00:00:00+09:00,2019,京都府,135.335495,35.42701
4130001063921,株式会社ロングフェローインターナショナル,京都府京都市下京区油小路通木津屋橋下る北不動堂町５２２番地１アンビエント京都駅前１００１号,6008233.0,,2019-02-19 00:00:00+09:00,2019,京都府,135.754715,34.988209
4130001066065,アール・テック・サービス株式会社,京都府舞鶴市字吉野４９９番地１２,6250003.0,,2022-09-27 00:00:00+09:00,2020,京都府,135.430374,35.499306
4130001066692,ホロバイオ株式会社,京都府京都市西京区御陵大原１番地の３６京大桂ベンチャープラザ,6158245.0,,2023-04-28 00:00:00+09:00,2020,京都府,135.680527,34.977081
4130001067328,株式会社ＧＬＯＢＡＬ　ＩＴ　ＳＯＬＵＴＩＯＮＳ,京都府京都市中京区小川通六角下る元本能寺町３８２番地,6048244.0,,2020-07-27 00:00:00+09:00,2020,京都府,135.754227,35.015533
4130001068185,株式会社Ｈｅｌｐｆｅｅｌ,京都府京都市上京区御所八幡町１１０−１６かわもとビル５階,6020023.0,,2022-10-19 00:00:00+09:00,2020,京都府,135.758987,35.030273
4130001069415,株式会社トフレック,京都府京都市南区上鳥羽高畠町１０６番地１,6018101.0,,2021-08-05 00:00:00+09:00,2021,京都府,135.745514,34.971832
4130001069472,ＥＩＪ株式会社,京都府京都市中京区河原町通御池下る下丸屋町３９０番地２Ｑｕｅｓｔｉｏｎビル内,6048006.0,,2021-06-07 00:00:00+09:00,2021,京都府,135.754501,35.008553
4130001069869,株式会社ＹＫ企画,京都府京都市中京区御池通東洞院東入笹屋町４３６番地永和御池ビル６０６号,6048187.0,,2021-08-05 00:00:00+09:00,2021,京都府,135.761856,35.01099
4130001070182,ソシオジャパン株式会社,京都府京都市伏見区新町３丁目４９２−１−４０３,6128081.0,,2021-10-01 00:00:00+09:00,2021,京都府,135.762939,34.931057
4130001070463,株式会社三ツ丸ホールディングス,京都府福知山市篠尾新町３丁目１１６番１,6200055.0,,2021-11-05 00:00:00+09:00,2021,京都府,135.111908,35.302505
4130005016487,一般社団法人難民ナウ,京都府京都市左京区田中下柳町７番地２かぜのね２０３号室,6068204.0,,2022-05-24 00:00:00+09:00,2022,京都府,135.773254,35.029575
5130001068770,株式会社ＧＵＲＧＡＯＮ,京都府京都市下京区松原通烏丸西入ル玉津島町２９４,6000000.0,,2022-05-31 00:00:00+09:00,2021,京都府,135.759445,34.999508
5130003008304,合同会社ＶＯＮＴＥＮ,京都府舞鶴市字北吸１０３９−１３赤れんがパーク４号棟２階,6250080.0,,2022-11-14 00:00:00+09:00,2022,京都府,135.381454,35.476192
6130001063804,株式会社ＳＨＩＮＳＥＫＩ,京都府京都市下京区玉津島町２９１マキタビル２Ｆ,6008427.0,,2020-10-01 00:00:00+09:00,2019,京都府,135.75856,34.999008
6130001064711,プロダクトソリューションエンジニアリング株式会社,京都府京都市北区等持院南町３８番地２４,6038344.0,,2019-06-21 00:00:00+09:00,2019,京都府,135.725174,35.026314
6130001066245,新医療リアルワールドデータ研究機構株式会社,京都府京都市左京区吉田本町３６番地１,6068317.0,,2020-02-07 00:00:00+09:00,2020,京都府,135.780807,35.026318
6130001066658,株式会社センジュ,京都府長岡京市馬場２丁目４番７号,6170828.0,,2020-04-08 00:00:00+09:00,2020,京都府,135.702286,34.928589
6130001070858,山奉株式会社,京都府綾部市多田町前路１１番地の１,6230004.0,,2022-01-11 00:00:00+09:00,2022,京都府,135.270447,35.321098
6130001072219,オムニリンクス株式会社,京都府京都市下京区石不動之町６８２番地６,6008047.0,,2022-07-22 00:00:00+09:00,2022,京都府,135.765854,34.998837
6130003005861,合同会社アットアイデア,京都府京都市伏見区桃山水野左近西町４８番地６,6120059.0,,2019-02-12 00:00:00+09:00,2019,京都府,135.766037,34.942867
6130003006067,株式会社ＰｉｘｅｌＥｎｇｉｎｅ,京都府京都市左京区田中上玄京町４７番地,6068215.0,,2021-06-09 00:00:00+09:00,2019,京都府,135.778183,35.033325
7130001066979,株式会社トライソリューション,京都府京都市左京区下鴨夜光町１６−１コスモエル下鴨,6060837.0,,2021-06-17 00:00:00+09:00,2020,京都府,135.771378,35.049122
7130001068199,株式会社Ｓｙｍｐｈｏｅｎｉｘ,京都府京都市上京区宮垣町９１番地,6020853.0,,2022-03-16 00:00:00+09:00,2020,京都府,135.769699,35.021595
7130001071608,アーカイラス株式会社,京都府京都市下京区中堂寺南町１３４番地京都高度技術研究所８Ｆ８Ｅ０９,6008813.0,,2022-04-19 00:00:00+09:00,2022,京都府,135.740936,34.995098
7130001074453,株式会社ホワイトクラン,京都府京都市山科区東野中井ノ上町２番地２１マルイハイツ１階,6078142.0,,2023-06-05 00:00:00+09:00,2023,京都府,135.817139,34.981152
7130003006702,イーモン合同会社,京都府京田辺市薪水取５１番地１２,6100341.0,,2020-08-07 00:00:00+09:00,2020,京都府,135.75592,34.828018
7130003007345,サービタイジング・エクセレンス合同会社,京都府京都市伏見区桃山町正宗４９番地６,6120856.0,,2021-07-07 00:00:00+09:00,2021,京都府,135.773193,34.942902
8130001065006,丹和米油株式会社,京都府舞鶴市字堀上４０番地の１,6240934.0,,2019-08-16 00:00:00+09:00,2019,京都府,135.325394,35.447651
8130001069584,株式会社日本フェムトセンシング,京都府久世郡久御山町森川端８７番地１オクトワークス２Ｆ,6130024.0,,2022-05-06 00:00:00+09:00,2021,京都府,135.742676,34.895576
8130001070328,株式会社ルートライン,京都府京都市伏見区深草西浦町１丁目１８番地名神第一ビル６階Ｃ,6120029.0,,2021-10-14 00:00:00+09:00,2021,京都府,135.761856,34.96077
8130001072266,土山印刷株式会社,京都府京都市南区吉祥院向田東町１４番地,6018308.0,,2022-07-25 00:00:00+09:00,2022,京都府,135.72525,34.984509
8130003007294,合同会社ＭＡＫＥ−ＯＮＥ,京都府京都市左京区高野清水町１３６番地,6068102.0,,2021-06-16 00:00:00+09:00,2021,京都府,135.777634,35.036026
8130005015766,関西連合警備業協同組合,京都府京都市南区東九条南河辺町１−１,6018034.0,,2023-06-13 00:00:00+09:00,2019,京都府,135.757751,34.97163
9130001063974,株式会社アーボプラス,京都府京都市北区紫野下柏野町１４番地２４,6038313.0,,2019-02-25 00:00:00+09:00,2019,京都府,135.737488,35.033466
9130001064477,株式会社Ｓｐａｃｅ　Ｐｏｗｅｒ　Ｔｅｃｈｎｏｌｏｇｉｅｓ,京都府京都市西京区御陵大原１番３６号京大桂ベンチャープラザ北館,6158245.0,,2019-05-28 00:00:00+09:00,2019,京都府,135.680527,34.977081
9130001065517,株式会社藤村産業,京都府城陽市富野荒見田１５７番地の１２,6100111.0,,2019-10-21 00:00:00+09:00,2019,京都府,135.784668,34.840366
9130001065673,株式会社ディーエル・ワールド京都,京都府京都市南区吉祥院清水町３６番地,6018329.0,,2019-11-18 00:00:00+09:00,2019,京都府,135.733063,34.978928
9130001066977,株式会社アエロジャパン,京都府福知山市字大内１１９９番地の１,6200836.0,,2020-05-28 00:00:00+09:00,2020,京都府,135.188385,35.237625
9130001067208,きづきアーキテクト株式会社,京都府京都市東山区三条通白川橋東入３丁目夷町１５５番地,6050033.0,,2022-05-19 00:00:00+09:00,2020,京都府,135.781281,35.009186
9130001068610,株式会社ｓｔａｃｋ,京都府京都市中京区衣棚通二条下る上妙覚寺町２２１番地−１０１,6040025.0,,2021-02-10 00:00:00+09:00,2020,京都府,135.757416,35.008549
9130001071077,株式会社京都ぐらし,京都府宇治市伊勢田町毛語１２８−２辻ニューコーポ１０１,6110043.0,,2022-02-04 00:00:00+09:00,2022,京都府,135.774078,34.885368
9130001071457,株式会社エヌ・チーム,京都府京都市下京区中堂寺南町１３４番地ＡＳＴＥＭ棟８階,6008813.0,,2022-04-08 00:00:00+09:00,2022,京都府,135.740936,34.995098
9130001073560,スギノエイチ株式会社,京都府京都市下京区中堂寺南町１３４番地,6008813.0,,2023-01-25 00:00:00+09:00,2023,京都府,135.740936,34.995098
9130003006469,合同会社エリタージュ,京都府京都市下京区大政所町６８０番地１,6008413.0,,2020-03-25 00:00:00+09:00,2020,京都府,135.759384,35.000725
9130005015955,一般財団法人大和松寿会,京都府京都市中京区三条通高倉東入桝屋町５８番地、５６番地,6048111.0,,2020-07-21 00:00:00+09:00,2020,京都府,135.749802,35.008492
1120001220220,株式会社ＥＢＰＭ研究所,大阪府大阪市北区梅田１丁目３番１号,5300001.0,,2019-04-15 00:00:00+09:00,2019,大阪府,135.49704,34.698494
1120001220674,八翔ビル管理株式会社,大阪府大阪市大正区三軒家東１丁目１７番２６号,5510002.0,,2019-05-13 00:00:00+09:00,2019,大阪府,135.479156,34.665707
1120001221937,シナジーマーケティング株式会社,大阪府大阪市北区堂島１丁目６番２０号,5300003.0,,2019-10-11 00:00:00+09:00,2019,大阪府,135.495636,34.697212
1120001223140,株式会社ベストラ,大阪府吹田市江坂町３丁目１５−２Ｂ６,5640063.0,,2023-05-09 00:00:00+09:00,2019,大阪府,135.495316,34.764912
1120001224048,株式会社ＳＯＲＡ,大阪府大阪市東淀川区南江口１丁目５番１２−３０１号,5330003.0,,2019-10-04 00:00:00+09:00,2019,大阪府,135.544525,34.755009
1120001224163,Ｄａｉｇａｓガスアンドパワーソリューション株式会社,大阪府大阪市中央区道修町３丁目５番１１号,5410045.0,,2020-05-18 00:00:00+09:00,2019,大阪府,135.501114,34.688683
1120001225979,株式会社京星,大阪府枚方市大字尊延寺９６５番地,5730112.0,,2020-03-11 00:00:00+09:00,2019,大阪府,135.724411,34.805191
1120001226267,いけだプロジェクト株式会社,大阪府大阪市西区千代崎１丁目２番４８号,5500023.0,,2020-01-14 00:00:00+09:00,2020,大阪府,135.481293,34.675003
1120001234625,株式会社シーダ,大阪府大阪市都島区高倉町２丁目１番４号,5340011.0,,2021-01-19 00:00:00+09:00,2021,大阪府,135.530624,34.715336
1120001237652,株式会社ほっかほっか亭総本部,大阪府大阪市北区鶴野町３番１０号,5300014.0,,2021-05-24 00:00:00+09:00,2021,大阪府,135.500809,34.707863
1120001238972,株式会社ｆａｎｆａｒｅ,大阪府大阪市北区堂島浜１丁目４−４アクア堂島フォンターナ３階,5300004.0,,2021-07-13 00:00:00+09:00,2021,大阪府,135.496841,34.695118
1120001239871,美住ハウス株式会社,大阪府大阪市生野区中川４丁目１２−１５,5440005.0,,2021-08-20 00:00:00+09:00,2021,大阪府,135.542038,34.657288
1120001242611,Ａ　Ｋｎｏｔｓ株式会社,大阪府大阪市天王寺区味原町１４番３号上本町東ビル４Ｆ,5430023.0,,2023-04-21 00:00:00+09:00,2021,大阪府,135.527939,34.666454
1120001247148,株式会社大阪シミズ,大阪府大阪市中央区博労町４丁目４番１１号,5410059.0,,2022-07-06 00:00:00+09:00,2022,大阪府,135.499069,34.678673
1120001252461,株式会社グローアップ,大阪府大阪市西区江戸堀１丁目２３番１３号,5500002.0,,2023-02-13 00:00:00+09:00,2023,大阪府,135.493896,34.689419
1120001253492,梅田警備株式会社,大阪府大阪市北区万歳町３番１２号萬栄ビル５０５,5300028.0,,2023-03-27 00:00:00+09:00,2023,大阪府,135.503464,34.704834
1120003015890,合同会社継続舎,大阪府枚方市長尾元町２丁目１番３５−６０７号,5730163.0,,2021-05-18 00:00:00+09:00,2019,大阪府,135.703125,34.826824
1120003017929,合同会社ｃｏｎｎｅｃｔ,大阪府大阪市淀川区西宮原２丁目３−３５−３０２,5320004.0,,2020-08-26 00:00:00+09:00,2020,大阪府,135.494034,34.736233
1120005022480,一般社団法人日本こころとからだバランス研究所,大阪府大阪市浪速区難波中２丁目７番２５号ナンバビル１０１,5560011.0,,2021-09-07 00:00:00+09:00,2021,大阪府,135.503784,34.661804
1120005022984,あやめ監査法人,大阪府大阪市北区天満２丁目１番２７号,5300043.0,,2022-06-10 00:00:00+09:00,2022,大阪府,135.517319,34.692875
1120101060285,株式会社協和グリーン,大阪府大阪市東住吉区山坂４丁目６番４号コモド山坂１０１号,5460035.0,,2023-02-08 00:00:00+09:00,2019,大阪府,135.520599,34.620354
1120101065433,株式会社ダイアグノーズ,大阪府和泉市府中町７丁目５番５２−５０１号,5940071.0,,2022-04-20 00:00:00+09:00,2022,大阪府,135.426727,34.489132
1120101067000,阪堺冷熱株式会社,大阪府堺市西区堀上緑町２丁１７番９−１０２号,5938305.0,,2023-02-16 00:00:00+09:00,2023,大阪府,135.483673,34.532246
1120901041897,Ｐｅｅｌ　Ｃｏｎｓｕｌｔｉｎｇ株式会社,大阪府茨木市宮元町７番２２号仲辻ビル５Ｄ号室,5670810.0,,2019-10-23 00:00:00+09:00,2019,大阪府,135.575165,34.821438
1120901042268,株式会社ＳＫＹリサーチ,大阪府豊中市新千里東町１丁目４番１号,5600082.0,,2020-01-17 00:00:00+09:00,2020,大阪府,135.496002,34.812054
1120901044578,ＪＲ西日本光ネットワーク株式会社,大阪府吹田市南吹田１丁目７番１号,5640043.0,,2021-07-06 00:00:00+09:00,2021,大阪府,135.510895,34.751511
1120901047291,株式会社アースリッチ,大阪府高槻市須賀町３５−１,5690022.0,,2023-03-23 00:00:00+09:00,2023,大阪府,135.639206,34.838364
1122001034113,オンキヨー株式会社,大阪府大阪市中央区南船場１丁目３番９号,5420081.0,,2022-07-04 00:00:00+09:00,2020,大阪府,135.510208,34.675365
1480001010932,株式会社ドリーム警備,大阪府大阪市中央区北久宝寺町４丁目３番１２号５Ｆ,5410057.0,,2021-08-20 00:00:00+09:00,2020,大阪府,135.499023,34.679714
2120001218866,株式会社エイチエムエー,大阪府大阪市淀川区新北野３丁目１２番５−２０３号,5320025.0,,2019-02-14 00:00:00+09:00,2019,大阪府,135.472931,34.713428
2120001218932,ここむ株式会社,大阪府大阪市中央区南新町２丁目２番１０号,5400024.0,,2019-02-18 00:00:00+09:00,2019,大阪府,135.513885,34.684597
2120001220104,関包スチールホールディングス株式会社,大阪府大阪市西区靱本町１丁目６番２１号,5500004.0,,2019-04-15 00:00:00+09:00,2019,大阪府,135.497101,34.68602
2120001232792,株式会社ＳＡＬＬＹ,大阪府大阪市天王寺区空堀町１３番５号,5430012.0,,2020-10-30 00:00:00+09:00,2020,大阪府,135.527023,34.674519
2120001234203,株式会社パートナーワン,大阪府大阪市住之江区西加賀屋４丁目６番８号,5590016.0,,2021-01-06 00:00:00+09:00,2020,大阪府,135.475159,34.615356
2120001234582,株式会社Ｉ−ＰＡＴＨ,大阪府大阪市中央区材木町１−６第１２新興ビル６０１,5400010.0,,2023-03-20 00:00:00+09:00,2021,大阪府,135.511826,34.680111
2120001234913,株式会社鷹ノ家リフォーム,大阪府大阪市平野区喜連西３丁目１３番２３号,5470026.0,,2021-02-02 00:00:00+09:00,2021,大阪府,135.543152,34.612305
2120001239251,株式会社ＥＸ‐Ｆｕｓｉｏｎ,大阪府吹田市山田丘２番８号,5650871.0,,2022-05-02 00:00:00+09:00,2021,大阪府,135.527527,34.81937
2120001243757,株式会社マルエイ工務店,大阪府門真市島頭１丁目３番１６号,5710016.0,,2022-02-09 00:00:00+09:00,2022,大阪府,135.610077,34.736565
2120001245423,株式会社ピアノ買取ピアノワン,大阪府寝屋川市香里北之町２−６香里園テレプラス２０３,5720080.0,,2022-04-22 00:00:00+09:00,2022,大阪府,135.62999,34.787315
2120001246586,ファブラス株式会社,大阪府松原市西野々１丁目８−１１,5800004.0,,2022-12-27 00:00:00+09:00,2022,大阪府,135.564423,34.576214
2120001247790,株式会社Ｄｏｃｔｏｒ’ｓ　Ｆｉｔｎｅｓｓ,大阪府大阪市東淀川区東中島１丁目２０番１９号新大阪ヒカリビル９階,5330033.0,,2022-08-01 00:00:00+09:00,2022,大阪府,135.503876,34.734112
2120003022597,合同会社ＨＫＢ,大阪府大阪市東住吉区住道矢田８丁目１８番１４号,5460022.0,,2022-10-05 00:00:00+09:00,2022,大阪府,135.543625,34.6022
2120105009402,一般社団法人ＬＩＦＥ−ＵＰ,大阪府河内長野市小山田町２７８５番地の３,5860094.0,,2021-05-24 00:00:00+09:00,2021,大阪府,135.553421,34.460213
2120105009435,行政書士法人ケイティオフィス,大阪府堺市東区日置荘田中町２３９番地２,5998113.0,,2022-08-18 00:00:00+09:00,2021,大阪府,135.528061,34.532688
2120901041137,株式会社組合立森林研究所,大阪府高槻市大字原１０５２番地の１,5691051.0,,2019-04-09 00:00:00+09:00,2019,大阪府,135.606583,34.901894
2120901044164,株式会社すまいるプラス,大阪府吹田市豊津町３０番１号,5640051.0,,2023-04-14 00:00:00+09:00,2021,大阪府,135.493332,34.761265
2120901045245,株式会社ハマダグミ,大阪府吹田市新芦屋上５番１−３０３,5650804.0,,2021-11-22 00:00:00+09:00,2021,大阪府,135.552505,34.800663
2120901046243,株式会社アビリティコード,大阪府箕面市西小路２丁目３番４号１０１号室,5620003.0,,2022-07-12 00:00:00+09:00,2022,大阪府,135.468033,34.828564
2120903003226,合同会社もりの審査,大阪府吹田市山田西３丁目２９番１６号,5650824.0,,2020-05-27 00:00:00+09:00,2020,大阪府,135.51738,34.801853
2120903004521,合同会社Ｂａｒｔ．ｌａｂ,大阪府豊中市稲津町３丁目６番３号,5610854.0,,2023-03-06 00:00:00+09:00,2023,大阪府,135.477432,34.753143
2122001034533,村上給食株式会社,大阪府東大阪市稲田新町３丁目４番１１号,5770004.0,,2021-06-04 00:00:00+09:00,2021,大阪府,135.592712,34.68729
2140001117604,株式会社司電業,大阪府大阪市北区同心２丁目１１番１９号３０２,5300035.0,,2020-12-25 00:00:00+09:00,2020,大阪府,135.515152,34.703403
2180005018654,一般財団法人産業保健振興財団,大阪府大阪市淀川区宮原２丁目７番１２号,5320003.0,,2021-03-11 00:00:00+09:00,2020,大阪府,135.501205,34.739162
3120001219855,株式会社ＣＯＰＥＬコンサルティング,大阪府大阪市中央区久太郎町４丁目１番３号大阪センタービル６階−１９,5410056.0,,2019-03-29 00:00:00+09:00,2019,大阪府,135.500305,34.681232
