corporate_number,name,location,postal_code,status,update_date,founded_year,都道府県,longitude,latitude
5010601057078,株式会社アスマップ,東京都江東区亀戸２丁目３番６号,1360071.0,,2022-07-01 00:00:00+09:00,2020,東京都,139.820816,35.698914
5010601057169,ＨＡＲＤＷＯＯＤ株式会社,東京都江東区亀戸４丁目１２−３,1360071.0,,2020-04-06 00:00:00+09:00,2020,東京都,139.829163,35.701237
5010601057359,株式会社Ｊａｐａｎ　ＡｖｉｏＴｅｃｈ,東京都大田区羽田空港１丁目８番２号５階,1440041.0,,2021-09-22 00:00:00+09:00,2020,東京都,139.754211,35.555969
5010601058464,株式会社善略,東京都江東区有明３丁目７番２６号有明フロンティアビルＢ棟９階,1350063.0,,2020-12-14 00:00:00+09:00,2020,東京都,139.791428,35.631367
5010601060164,株式会社クリエイティブ・ラボ,東京都江東区豊洲５丁目６番５２号,1350061.0,,2021-11-05 00:00:00+09:00,2021,東京都,139.799591,35.651131
5010601062706,株式会社オメガソリューションズ,東京都江東区塩浜２丁目７番５−３４７号,1350043.0,,2023-03-07 00:00:00+09:00,2023,東京都,139.806259,35.662041
5010701038762,株式会社つまり,東京都品川区戸越４丁目３番７号,1420041.0,,2020-01-27 00:00:00+09:00,2020,東京都,139.720398,35.61285
5010701039570,ＴＯＵＣＨ　ＧＲＯＵＰ株式会社,東京都品川区小山６丁目２６番１２号,1420062.0,,2020-07-22 00:00:00+09:00,2020,東京都,139.69635,35.612301
5010701040388,株式会社ＩＭＡＧＩＣＡ　Ｌａｂ．,東京都品川区東品川３丁目１３番６号,1400002.0,,2022-02-21 00:00:00+09:00,2021,東京都,139.747574,35.615288
5010701043696,株式会社イントワーズ,東京都品川区南品川３丁目４番１−４０４号,1400004.0,,2023-01-17 00:00:00+09:00,2023,東京都,139.743256,35.60894
5010703004713,合同会社ソギーソフトウェア,東京都千代田区飯田橋１丁目８番９号ニューシティハイツ飯田橋７０７,1020072.0,,2020-05-19 00:00:00+09:00,2019,東京都,139.748505,35.699574
5010901045559,日本流通管理支援機構株式会社,東京都世田谷区北沢２丁目３０−８,1550031.0,,2020-01-17 00:00:00+09:00,2020,東京都,139.667206,35.663227
5010901050476,株式会社ＶＡＮ　ＦＵＮ,東京都世田谷区若林１丁目１番２４号サンチャ・パロス・バルデス１０１号室,1540023.0,,2022-03-07 00:00:00+09:00,2022,東京都,139.665268,35.643772
5010901051391,株式会社テックブイ,東京都世田谷区北沢１丁目３３番１９号,1550031.0,,2022-08-10 00:00:00+09:00,2022,東京都,139.672485,35.660904
5010901051788,株式会社ＴＨＩＮＫＳＴＨＩＮＫＳ,東京都世田谷区松原２丁目３８−９明大前グランドハイツ９０３,1560043.0,,2022-10-17 00:00:00+09:00,2022,東京都,139.647797,35.668617
5010903007771,Ｂ・Ｂ　Ｐｌａｎｎｉｎｇ合同会社,東京都世田谷区船橋１丁目３９番１０号,1560055.0,,2022-11-09 00:00:00+09:00,2022,東京都,139.619446,35.648979
5011001126605,株式会社ブランチ,東京都渋谷区広尾５丁目２３番５号,1500012.0,,2021-06-04 00:00:00+09:00,2019,東京都,139.718307,35.648613
5011001129780,株式会社ＫＥＳＩＫＩ,東京都渋谷区神宮前５丁目４８番１号,1500001.0,,2021-05-21 00:00:00+09:00,2019,東京都,139.709122,35.66386
5011001133436,株式会社ｍｏｏｖｙ,東京都渋谷区道玄坂１丁目１８−３プレミア道玄坂８階,1500043.0,,2020-12-15 00:00:00+09:00,2020,東京都,139.69696,35.657368
5011001134401,株式会社ＩｎＶｉｔｒｏ,東京都豊島区南大塚３丁目３０−１４サンヒルズビル３階,1700005.0,,2022-08-02 00:00:00+09:00,2020,東京都,139.725876,35.731102
5011001137503,株式会社Ｃｉｔａｄｅｌ　ＡＩ,東京都渋谷区代々木４丁目６２番７号パークハウス代々木参宮橋１０３,1510053.0,,2022-06-01 00:00:00+09:00,2020,東京都,139.689514,35.677528
5011001138955,Ｇｏｏｄｗｅｌｌ株式会社,東京都新宿区西新宿３丁目３番１３号西新宿水間ビル６階,1600023.0,,2021-11-17 00:00:00+09:00,2021,東京都,139.692841,35.685883
5011001139755,株式会社ソウ・スウィート・パブリッシング,東京都渋谷区道玄坂１丁目２−３渋谷フクラス１７Ｆ,1500043.0,,2021-04-15 00:00:00+09:00,2021,東京都,139.700531,35.657677
5011001141579,株式会社ロックトゥーン,東京都中央区新川１丁目１７−１１−１２０７,1040033.0,,2022-10-26 00:00:00+09:00,2021,東京都,139.784576,35.678062
5011001144004,株式会社Ｃｏｎｎｅｃ．ｔ,東京都渋谷区神宮前６丁目２３−４桑野ビル２Ｆ,1500001.0,,2021-11-18 00:00:00+09:00,2021,東京都,139.702484,35.664951
5011001144012,株式会社ソーシャル・エックス,東京都渋谷区渋谷２丁目２１番１号,1500002.0,,2021-11-25 00:00:00+09:00,2021,東京都,139.703964,35.659267
5011001150191,あつまる株式会社,東京都渋谷区渋谷１丁目８番５号,1500002.0,,2022-10-13 00:00:00+09:00,2022,東京都,139.705444,35.660213
5011001151479,ウィーメックス株式会社,東京都渋谷区渋谷３丁目２５番１８号,1500002.0,,2023-04-17 00:00:00+09:00,2022,東京都,139.705139,35.655155
5011001151487,株式会社アップデートサポート,東京都渋谷区渋谷１丁目１７番８号,1500002.0,,2022-12-20 00:00:00+09:00,2022,東京都,139.704163,35.661224
5011003010831,モダルコ合同会社,東京都渋谷区円山町５番５号Ｎａｖｉ渋谷?３Ｆ,1500044.0,,2020-01-31 00:00:00+09:00,2020,東京都,139.695465,35.656757
5011005008725,一般社団法人ＨＲテクノロジーコンソーシアム,東京都渋谷区渋谷３丁目６番２号エクラート渋谷５階,1500002.0,,2022-06-09 00:00:00+09:00,2020,東京都,139.705002,35.657997
5011101087029,プラウドエンジン株式会社,東京都千代田区麹町５丁目４番地,1020083.0,,2022-12-08 00:00:00+09:00,2019,東京都,139.734039,35.684734
5011101087367,ＡＩＴＯＹＡ株式会社,東京都新宿区高田馬場４丁目３７番２号ヴェルフォーレＷ３０３,1690075.0,,2020-12-04 00:00:00+09:00,2019,東京都,139.697708,35.710152
5011101088852,母子モ株式会社,東京都新宿区西新宿３丁目２０番２号,1600023.0,,2019-09-09 00:00:00+09:00,2019,東京都,139.685852,35.684101
5011101089289,株式会社レイ・イージス・ジャパン,東京都新宿区西新宿７丁目２２番３３号Ｐｏｌａｒ西新宿４階,1600023.0,,2023-04-27 00:00:00+09:00,2019,東京都,139.696701,35.696712
5011101090247,スリーハンドレッド株式会社,東京都新宿区中里町２６番地,1620804.0,,2020-01-30 00:00:00+09:00,2020,東京都,139.732956,35.706474
5011101090313,株式会社チョイシーズ,東京都港区南青山２丁目２番１５号,1070062.0,,2022-08-15 00:00:00+09:00,2020,東京都,139.724106,35.67149
5011101097564,株式会社ｉＴＣパートナーズ,東京都新宿区新宿１丁目３６番２号新宿第七葉山ビル,1600022.0,,2022-12-28 00:00:00+09:00,2022,東京都,139.710358,35.690296
5011101101714,株式会社ＳｙｎｅｒｇｙＥｆｆｅｃｔ,東京都新宿区西新宿３丁目３番１３号西新宿水間ビル６階,1600023.0,,2023-02-03 00:00:00+09:00,2023,東京都,139.692841,35.685883
5011103009732,ＯＭＧムーブメント合同会社,東京都新宿区新宿１丁目３６番２号,1600022.0,,2020-06-05 00:00:00+09:00,2020,東京都,139.710358,35.690296
5011103010731,Ｌｅｖｅｌ９Ｃｏａｃｈｉｎｇ合同会社,東京都新宿区西新宿６丁目１２番７号ストーク新宿１階Ｃ−１４,1600023.0,,2021-06-01 00:00:00+09:00,2021,東京都,139.689728,35.693386
5011105009334,一般社団法人全国手をつなぐ育成会連合会,東京都新宿区西新宿７丁目１７番６号第三和幸ビル２Ｃ,1600023.0,,2020-04-16 00:00:00+09:00,2020,東京都,139.696808,35.696758
5011201022018,株式会社ｍｉｍｏｉｄ,東京都渋谷区代々木３丁目３１−１２代々木ハイツ１号館１０８号室,1510053.0,,2020-08-04 00:00:00+09:00,2020,東京都,139.69397,35.683064
5011201023890,株式会社オッケーテラバイト,東京都港区赤坂７丁目６番５２号ハイツ赤坂１０４,1070052.0,,2023-06-09 00:00:00+09:00,2022,東京都,139.730896,35.670952
5011205002429,一般社団法人日本救急診療研究機構,東京都中野区中野２丁目２番３号株式会社へるす出版内,1640001.0,,2021-03-29 00:00:00+09:00,2021,東京都,139.670792,35.702618
5011301028732,株式会社中村書店,東京都杉並区浜田山１丁目２４番２０号ラセイム新美?１２２,1680065.0,,2023-05-26 00:00:00+09:00,2023,東京都,139.629959,35.679981
5011401022305,株式会社Ｋｌａｓｔｒｏｍ,東京都板橋区前野町３丁目１番１−３０８号,1740063.0,,2021-03-15 00:00:00+09:00,2019,東京都,139.693039,35.765633
5011401022552,株式会社ＨｕｍａｎＬｉｆｅＰｌｕｓ,東京都板橋区赤塚６丁目６番１０号,1750092.0,,2020-05-11 00:00:00+09:00,2020,東京都,139.645767,35.775272
5011401024375,ＰｗＤパートナーズ株式会社,東京都板橋区赤塚２丁目１番１２号,1750092.0,,2022-07-05 00:00:00+09:00,2022,東京都,139.645508,35.770657
5011601025339,株式会社Ｋｏｍｅｔｓｕｂｕ　Ｅｎｔｅｒｔａｉｎｍｅｎｔ,東京都港区海岸１丁目７番１号,1050022.0,,2023-03-14 00:00:00+09:00,2021,東京都,139.760864,35.655045
5011603002567,ＬＥＢ　ＰＬＵＳ合同会社,東京都練馬区練馬２丁目３３−１８,1760001.0,,2021-03-01 00:00:00+09:00,2019,東京都,139.655563,35.745945
5011605002441,税理士法人ＳＡＫＵＲＡ,東京都練馬区桜台４丁目１９−１７,1760002.0,,2022-04-08 00:00:00+09:00,2022,東京都,139.657867,35.739723
5011801035773,株式会社ｔｏ,東京都目黒区上目黒３丁目１番４号中目黒グリーンプラザビル４Ｆ,1530051.0,,2021-07-08 00:00:00+09:00,2019,東京都,139.697739,35.645283
5011801036482,Ｃｏｏｌ　Ｂｉｒｄ株式会社,東京都中央区東日本橋２丁目２８番４号日本橋ＣＥＴビル２階,1030004.0,,2020-06-19 00:00:00+09:00,2019,東京都,139.78743,35.69474
5011801037472,株式会社ｃｏｍｏｄｏ,東京都葛飾区水元４丁目１番１８号,1250032.0,,2020-04-06 00:00:00+09:00,2020,東京都,139.861023,35.784328
5011801037968,株式会社ノースハーバー,東京都足立区東綾瀬２丁目１４番８号,1200004.0,,2020-08-21 00:00:00+09:00,2020,東京都,139.833176,35.767017
5011801039023,株式会社ＦＵＫＵＳＨＩＭＡ,東京都葛飾区東立石４丁目４９番５号モンシャテーニュ２０１,1240013.0,,2022-04-15 00:00:00+09:00,2021,東京都,139.849716,35.737141
5012301011851,ヒッツエンタープライズ株式会社,東京都町田市相原町５９８番地１６,1940211.0,,2019-09-10 00:00:00+09:00,2019,東京都,139.338776,35.609726
5012301013006,株式会社サトウ植木,東京都町田市小山町３２４４番地６,1940212.0,,2022-06-03 00:00:00+09:00,2022,東京都,139.360336,35.600643
5012401036427,株式会社フライト,東京都小金井市東町１丁目８番２１号パーク・サイド・ヒル１０２,1840011.0,,2020-04-07 00:00:00+09:00,2020,東京都,139.523926,35.690308
5012401037499,アイテム株式会社,東京都府中市分梅町３丁目３６番地の５,1830033.0,,2021-04-28 00:00:00+09:00,2021,東京都,139.461227,35.667839
5012401039462,株式会社イェーガー,東京都小金井市本町１丁目１３番１３号,1840004.0,,2022-07-26 00:00:00+09:00,2022,東京都,139.509659,35.699413
5012403004992,合同会社リーサット,東京都多摩市中沢２丁目２４番１０号,2060036.0,,2021-08-18 00:00:00+09:00,2021,東京都,139.412949,35.617592
5012701015799,株式会社ＳＴＵＤＩＯ　ＣＡＲＮＥＴ,東京都千代田区平河町１丁目７−１３ラシクラス麹町２０１,1020093.0,,2023-03-16 00:00:00+09:00,2020,東京都,139.740631,35.682167
5012803003041,本多青果合同会社,東京都国分寺市西恋ヶ窪１丁目２番７号,1850013.0,,2023-03-31 00:00:00+09:00,2023,東京都,139.472397,35.700394
5012805002891,一般社団法人ピー・ピー・アイ・ジャパン,東京都港区浜松町２丁目２番１５号浜松町ダイヤビル２Ｆ,1050013.0,,2021-05-06 00:00:00+09:00,2019,東京都,139.754761,35.655102
5013101008468,ＴＭＳ株式会社,東京都青梅市新町６丁目１３番地の１６,1980024.0,,2020-10-20 00:00:00+09:00,2020,東京都,139.314667,35.794525
5013301043570,株式会社マイズソリューションズ,東京都豊島区南池袋２丁目４９番７号池袋パークビル１階,1710022.0,,2019-03-14 00:00:00+09:00,2019,東京都,139.716858,35.727161
5013301044536,株式会社アルカシステム,東京都豊島区南池袋２丁目１９番１号,1710022.0,,2019-12-26 00:00:00+09:00,2019,東京都,139.71431,35.725803
5013301045591,株式会社長野漁港技術事務所,東京都豊島区北大塚３丁目８番３号ライオンズシティー池袋１０４号,1700004.0,,2020-05-08 00:00:00+09:00,2020,東京都,139.721344,35.733936
5013301047729,株式会社山辺構造設計事務所,東京都豊島区駒込１丁目３７番１０号,1700003.0,,2021-07-15 00:00:00+09:00,2021,東京都,139.748322,35.735649
5013301048306,ＨＴＢエナジー株式会社,東京都豊島区西池袋１丁目４番１０号,1710021.0,,2023-04-11 00:00:00+09:00,2021,東京都,139.709152,35.728344
5020001131432,ＳＯＺＯＷ株式会社,東京都品川区東五反田５丁目１２番１号ロイヤルフラッツ２０１号室,1410022.0,,2023-05-31 00:00:00+09:00,2019,東京都,139.723343,35.629627
5020001137207,株式会社アドワン・ホーム,東京都港区六本木６丁目１０番１号六本木ヒルズ森タワー１６階,1060032.0,,2022-06-15 00:00:00+09:00,2020,東京都,139.729202,35.660206
5030001134310,ＦＳ　ＪＡＰＡＮ株式会社,東京都大田区平和島４丁目１番２３号５階,1430006.0,,2022-11-10 00:00:00+09:00,2019,東京都,139.741287,35.581123
5090005007325,一般社団法人トレイルブレイズハイキング研究所,東京都港区東麻布２丁目２８番６号,1060044.0,,2022-07-08 00:00:00+09:00,2020,東京都,139.74147,35.656029
6010001199932,株式会社エンターテイン,東京都千代田区大手町１丁目５番１号大手町ファーストスクエアイーストタワー４Ｆ,1000004.0,,2019-04-15 00:00:00+09:00,2019,東京都,139.764664,35.685574
6010001200294,株式会社Ｎｏ．１パートナー,東京都千代田区内幸町１丁目５番２号,1000011.0,,2019-04-25 00:00:00+09:00,2019,東京都,139.757599,35.669765
6010001201887,株式会社Ｑｕｅｍｉｘ,東京都中央区日本橋２丁目１１番２号,1030027.0,,2019-06-28 00:00:00+09:00,2019,東京都,139.774612,35.680679
6010001201994,株式会社夢真,東京都港区虎ノ門１丁目３番１号,1050001.0,,2022-07-07 00:00:00+09:00,2019,東京都,139.74968,35.669991
6010001202076,株式会社ＬｕａａＺ,東京都渋谷区恵比寿４丁目２０−３恵比寿ガーデンプレイスタワー１８階,1500013.0,,2020-08-24 00:00:00+09:00,2019,東京都,139.712708,35.643627
6010001203776,株式会社カシカガク,東京都千代田区東神田１丁目１３番１４号,1010031.0,,2020-07-28 00:00:00+09:00,2019,東京都,139.781525,35.694241
6010001204196,株式会社ＡｃｒｏＸ　Ｈｏｌｄｉｎｇｓ,東京都千代田区霞が関１丁目４番１号,1000013.0,,2019-10-03 00:00:00+09:00,2019,東京都,139.750793,35.670742
6010001204329,おかぴファーマシーシステム株式会社,東京都千代田区神田和泉町１番地,1010024.0,,2019-10-08 00:00:00+09:00,2019,東京都,139.77597,35.699192
6010001205855,オークス株式会社,東京都千代田区神田須田町１丁目６番地２４ＧＲＥＥＮＰＡＲＫ淡路町２０１,1010041.0,,2022-12-15 00:00:00+09:00,2019,東京都,139.768539,35.695061
6010001206523,株式会社ネットレックス・フィールドサービス,東京都中央区日本橋茅場町３丁目１１番１０号,1030025.0,,2020-01-14 00:00:00+09:00,2020,東京都,139.778976,35.677734
6010001206754,セキュアエッジテクノロジー株式会社,東京都新宿区下宮比町２番２６号,1620822.0,,2022-04-05 00:00:00+09:00,2020,東京都,139.744217,35.703655
6010001207158,株式会社オールリンクス,東京都中央区銀座７丁目１３番６号サガミビル２階,1040061.0,,2020-02-06 00:00:00+09:00,2020,東京都,139.764572,35.667824
6010001207521,株式会社ｅ−Ｅｄｕｃａｔｉｏｎ,東京都千代田区東神田１丁目２番８号,1010031.0,,2020-02-14 00:00:00+09:00,2020,東京都,139.780869,35.693611
6010001208214,株式会社上條・福島都市設計事務所,東京都新宿区住吉町１０番５号鍋倉ビル２階,1620065.0,,2022-05-16 00:00:00+09:00,2020,東京都,139.7202,35.694084
6010001210434,株式会社ａｉｌｙｓ,東京都中央区銀座８丁目１７番５号ＴＨＥ・ＨＵＢ銀座ＯＣＴ,1040061.0,,2023-03-14 00:00:00+09:00,2020,東京都,139.764359,35.666286
6010001212216,株式会社ＮｅｔＥｘｐｌｏｒｅｒ,東京都中央区築地３丁目９番１０号築地ビル１０階,1040045.0,,2023-03-07 00:00:00+09:00,2020,東京都,139.772919,35.668144
6010001212513,株式会社ワカルク,東京都中央区銀座６丁目１３番１６号銀座ＷａｌｌビルＵＣＦ５階,1040061.0,,2020-10-01 00:00:00+09:00,2020,東京都,139.76474,35.669003
6010001219079,衛星データサービス企画株式会社,東京都千代田区飯田橋４丁目６番１号,1020072.0,,2023-06-26 00:00:00+09:00,2021,東京都,139.747086,35.700825
6010001221183,スペリス株式会社,東京都中央区日本橋蛎殻町１丁目３７番９−２０２号ライオンズマンション日本橋第二２０２,1030014.0,,2021-09-15 00:00:00+09:00,2021,東京都,139.785583,35.682369
6010001221571,株式会社Ｇｏｏｄ　Ｈｅａｌｔｈ　Ｍｅｔｈｏｄ研究所,東京都千代田区内幸町２丁目２番３号日比谷国際ビル地下２階,1000011.0,,2021-10-07 00:00:00+09:00,2021,東京都,139.754822,35.670513
6010001222974,株式会社東京ダイケンビルサービス,東京都千代田区二番町１２番地２,1020084.0,,2021-12-03 00:00:00+09:00,2021,東京都,139.735794,35.686501
6010001224814,ケモインフォ株式会社,東京都中央区銀座１丁目２２番１１号銀座大竹ビジデンス２階,1040061.0,,2022-02-25 00:00:00+09:00,2022,東京都,139.770905,35.671829
6010001225011,株式会社イコーゼ,東京都千代田区九段南１丁目５−６りそな九段ビル５Ｆ,1020074.0,,2022-03-07 00:00:00+09:00,2022,東京都,139.751678,35.694996
6010001225663,プライムヴァース株式会社,東京都千代田区丸の内１丁目６番５号９Ｆ,1000005.0,,2022-04-20 00:00:00+09:00,2022,東京都,139.766266,35.683708
6010001226174,Ｎコンサルタンツ株式会社,東京都千代田区神田淡路町２丁目１番７号,1010063.0,,2022-04-28 00:00:00+09:00,2022,東京都,139.767242,35.696259
6010001227528,株式会社Ｄ．Ｆｏｒｃｅ,東京都中央区銀座１丁目１２番４号Ｎ＆Ｅ，ＢＬＤ．７階,1040061.0,,2022-06-21 00:00:00+09:00,2022,東京都,139.770126,35.674221
6010001232131,アンドレジリエンス株式会社,東京都中央区日本橋室町３丁目２番１号,1030022.0,,2023-01-11 00:00:00+09:00,2023,東京都,139.77272,35.687458
6010001234268,株式会社Ｒｅｖｉｔａｌｉｚｅ,東京都文京区湯島４丁目１１番１６号−２０６号,1130034.0,,2023-04-10 00:00:00+09:00,2023,東京都,139.766159,35.710197
6010003035152,Ｍａｋｅ　Ｊａｐａｎ合同会社,東京都中央区銀座１丁目２２−１１,1040061.0,,2021-06-28 00:00:00+09:00,2021,東京都,139.770905,35.671829
6010003038394,Ｓｅｒｉａｌ合同会社,東京都中央区銀座７丁目１３番２１号銀座新六洲ビル２Ｆ,1040061.0,,2022-08-19 00:00:00+09:00,2022,東京都,139.764328,35.668217
6010003040004,合同会社浅井太郎事務所,東京都中央区銀座１丁目２２番１１号,1040061.0,,2023-03-10 00:00:00+09:00,2023,東京都,139.770905,35.671829
6010005030564,社会保険労務士法人プラットワークス,東京都千代田区永田町２丁目１７番１７号,1000014.0,,2019-08-08 00:00:00+09:00,2019,東京都,139.74086,35.677074
6010005030663,ＢＩＭライブラリ技術研究組合,東京都中央区新川１丁目２４番８号,1040033.0,,2019-09-02 00:00:00+09:00,2019,東京都,139.785248,35.676395
6010005032239,医療法人社団紫穏会,東京都中央区日本橋２丁目２番２号マルヒロ日本橋ビル５階,1030027.0,,2020-09-07 00:00:00+09:00,2020,東京都,139.772293,35.682278
6010005032461,一般社団法人社会実装推進センター,東京都港区新橋４丁目７番４号,1050004.0,,2021-02-17 00:00:00+09:00,2020,東京都,139.755295,35.664555
6010005032511,一般財団法人保健福祉振興財団,東京都千代田区紀尾井町３番１２号,1020094.0,,2023-05-08 00:00:00+09:00,2020,東京都,139.73674,35.682922
6010005033633,一般社団法人日本老年療法学会,東京都千代田区一ツ橋１丁目１番１号パレスサイドビル株式会社毎日学術フォーラム内,1000003.0,,2021-07-15 00:00:00+09:00,2021,東京都,139.757507,35.690922
6010005034549,一般社団法人メイシス地域創生研究会,東京都中央区銀座６丁目４番８号曽根ビル,1040061.0,,2022-02-03 00:00:00+09:00,2022,東京都,139.761505,35.671059
6010005036173,一般社団法人アウトドアサウナ協会,東京都中央区築地６丁目１６番１号株式会社メトス内,1040045.0,,2023-01-31 00:00:00+09:00,2023,東京都,139.773972,35.664013
6010005036256,一般社団法人コンプライアンス・アンド・キャパシティ・スキル・インターナショナル・アジア太平洋,東京都千代田区九段南１丁目５番６号りそな九段ビル５Ｆ・ＫＳフロア,1020074.0,,2023-02-21 00:00:00+09:00,2023,東京都,139.751678,35.694996
6010101014322,株式会社エスレコ,東京都稲城市若葉台２丁目２番地,2060824.0,,2023-05-25 00:00:00+09:00,2020,東京都,139.474411,35.619846
6010401143837,Ｃｉｔｙ　Ｌｉｇｈｔｓ　Ｈｏｌｄｉｎｇｓ株式会社,東京都品川区東五反田１丁目６番３号,1410022.0,,2021-01-19 00:00:00+09:00,2019,東京都,139.726273,35.627323
6010401144876,株式会社プレパレーション,東京都渋谷区渋谷３丁目８番１２号渋谷第一生命ビルディング７階,1500002.0,,2020-05-08 00:00:00+09:00,2019,東京都,139.704041,35.657467
6010401148423,ＳＭＢＣクラウドサイン株式会社,東京都港区六本木４丁目１番４号,1060032.0,,2021-08-24 00:00:00+09:00,2019,東京都,139.735199,35.665058
6010401148472,図研モデリンクス株式会社,東京都港区新橋５丁目８番１１号,1050004.0,,2019-10-11 00:00:00+09:00,2019,東京都,139.754959,35.663471
6010401150965,デービープロ株式会社,東京都港区南青山６丁目８番３号,1070062.0,,2020-02-12 00:00:00+09:00,2020,東京都,139.716507,35.65987
6010401151708,Ｕ＆Ｉリーガルサポート株式会社,東京都港区赤坂１丁目１２番３２号,1070052.0,,2020-03-17 00:00:00+09:00,2020,東京都,139.741302,35.667343
6010401151864,株式会社ＥＭＩパートナーズ,東京都千代田区麹町２丁目１０番２号,1020083.0,,2021-02-01 00:00:00+09:00,2020,東京都,139.740524,35.685287
6010401153571,株式会社ＴＢＳアクト,東京都港区赤坂５丁目２番２０号,1070052.0,,2021-06-30 00:00:00+09:00,2020,東京都,139.73317,35.67231
6010401153794,株式会社Ｃ,東京都港区北青山２丁目１０番２０号,1070061.0,,2021-08-04 00:00:00+09:00,2020,東京都,139.715439,35.672188
6010401154990,Ｔａｌｋｗａｌｋｅｒ株式会社,東京都港区六本木１丁目４番５号アークヒルズサウスタワー１６階,1060032.0,,2020-09-07 00:00:00+09:00,2020,東京都,139.739304,35.665691
6010401155568,株式会社ｋｍＧオートアシスト,東京都港区赤坂２丁目８番６号,1070052.0,,2021-07-28 00:00:00+09:00,2020,東京都,139.740219,35.671673
6010401157878,株式会社ａｇｅ　ｍａｋｅｒ,東京都豊島区東池袋２丁目６１番５号津島ビル３Ｆ,1700013.0,,2023-05-29 00:00:00+09:00,2021,東京都,139.7173,35.733833
6010401158249,株式会社ママスクエアＨＲ−Ｐａｒｔｎｅｒｓ,東京都港区芝２丁目２２番１５号,1050014.0,,2021-02-18 00:00:00+09:00,2021,東京都,139.750763,35.651119
6010401158505,株式会社ワークスアプリケーションズ・エンタープライズ,東京都千代田区麹町２丁目５番１号,1020083.0,閉鎖,2023-04-24 00:00:00+09:00,2021,東京都,139.740601,35.683563
6010401164503,株式会社Ａｎｔｈｅｍ,東京都港区南麻布４丁目１３−５麻布矢野ビル１Ｆ,1060047.0,,2021-12-17 00:00:00+09:00,2021,東京都,139.723694,35.646992
6010401166516,ＭＤＫ株式会社,東京都港区港南２丁目１６番１号４Ｆ,1080075.0,,2022-04-04 00:00:00+09:00,2022,東京都,139.740677,35.626488
6010401171152,株式会社ＩＴＬＩＮＥ,東京都港区虎ノ門３丁目２５番５−１００３号,1050001.0,,2022-12-07 00:00:00+09:00,2022,東京都,139.745621,35.662418
6010401174329,株式会社仲裁審問東京施設,東京都港区赤坂１丁目１２番３２号,1070052.0,,2023-05-16 00:00:00+09:00,2023,東京都,139.741302,35.667343
